{
  "typeOfBusiness":"uk-property",
  "tradingName":"Business McBusiness",
  "firstAccountingPeriodStartDate": "2019-09-30",
  "firstAccountingPeriodEndDate":"2020-02-29",
  "latencyDetails": {
    "latencyEndDate": "2020-02-27",
    "taxYear1": "2018-19",
    "latencyIndicator1": "A",
    "taxYear2": "2019-20",
    "latencyIndicator2": "Q"
  },
  "accountingType":"CASH",
  "commencementDate":"2022-04-06",
  "cessationDate":"2023-04-06",
  "businessAddressLineOne":"221b Baker Street",
  "businessAddressLineTwo":"Marylebone",
  "businessAddressLineThree":"London",
  "businessAddressLineFour":"England",
  "businessAddressPostcode": "NW1 6XE",
  "businessAddressCountryCode":"GB"

}